{
  "id": "evt_01M11HEQG00000000000000000",
  "type": "case.assigned",
  "schema_version": "1.0",
  "created_at": "2026-09-18T09:00:00Z",
  "tenant_id": "ten_01M11HEQG00000000000000000",
  "region": "eu-west",
  "data": {
    "case_id": "rvc_01M11HEQG00000000000000000",
    "verification_id": "ver_01M11HEQG00000000000000000",
    "operator_id": "opr_01M11HEQG00000000000000000",
    "state": "active",
    "case": {
      "id": "rvc_01M11HEQG00000000000000000",
      "type": "review_case",
      "verification_id": "ver_01M11HEQG00000000000000000",
      "state": "claimed",
      "assigned_reviewer": "opr_01M11HEQG00000000000000000"
    }
  }
}
