{
  "id": "evt_01M11HEQG00000000000000000",
  "type": "decision.superseded",
  "schema_version": "1.0",
  "created_at": "2026-09-18T09:00:00Z",
  "tenant_id": "ten_01M11HEQG00000000000000000",
  "region": "eu-west",
  "data": {
    "decision_id": "dec_01M11HEQG00000000000000000",
    "verification_id": "ver_01M11HEQG00000000000000000",
    "policy_id": "pol_01M11HEQG00000000000000000",
    "revision": 1,
    "outcome": "verified",
    "decided_at": "2026-09-18T09:00:00Z",
    "previous_decision_id": "dec_01M11HEQG00000000000000001",
    "decision": {
      "id": "dec_01M11HEQG00000000000000000",
      "type": "decision",
      "verification_id": "ver_01M11HEQG00000000000000000",
      "policy_id": "pol_01M11HEQG00000000000000000",
      "revision": 1,
      "outcome": "verified",
      "decided_at": "2026-09-18T09:00:00Z",
      "previous_decision_id": "dec_01M11HEQG00000000000000001"
    }
  }
}
