{
  "id": "evt_01M11HEQG00000000000000000",
  "type": "evidence.ready",
  "schema_version": "1.0",
  "created_at": "2026-09-18T09:00:00Z",
  "tenant_id": "ten_01M11HEQG00000000000000000",
  "region": "eu-west",
  "data": {
    "evidence_id": "evd_01M11HEQG00000000000000000",
    "verification_id": "ver_01M11HEQG00000000000000000",
    "evidence_type": "idenqa.evidence.selfie",
    "artefact": "selfie",
    "acquisition_method": "idenqa.method.live_camera",
    "assurances": [
      "idenqa.assurance.live_capture",
      "idenqa.assurance.face_match_1to1"
    ],
    "media_type": "image/jpeg",
    "evidence": {
      "id": "evd_01M11HEQG00000000000000000",
      "type": "evidence",
      "verification_id": "ver_01M11HEQG00000000000000000",
      "evidence_type": "idenqa.evidence.selfie",
      "artefact": "selfie",
      "acquisition_method": "idenqa.method.live_camera",
      "assurances": [
        "idenqa.assurance.live_capture"
      ]
    }
  }
}
