{
  "id": "evt_01M11HEQG00000000000000000",
  "type": "case.finding_recorded",
  "schema_version": "1.0",
  "created_at": "2026-09-18T09:00:00Z",
  "tenant_id": "ten_01M11HEQG00000000000000000",
  "region": "eu-west",
  "data": {
    "case_id": "rvc_01M11HEQG00000000000000000",
    "verification_id": "ver_01M11HEQG00000000000000000",
    "finding_id": "fnd_01M11HEQG00000000000000000",
    "resolution": "satisfy",
    "reason_code": "policy.verified",
    "case": {
      "id": "rvc_01M11HEQG00000000000000000",
      "type": "review_case",
      "verification_id": "ver_01M11HEQG00000000000000000",
      "state": "resolved",
      "finding_id": "fnd_01M11HEQG00000000000000000",
      "resolution": "satisfy",
      "reason_code": "document_reviewed"
    }
  }
}
