{
  "id": "evt_01M11HEQG00000000000000000",
  "type": "processing_authority.restricted",
  "schema_version": "1.0",
  "created_at": "2026-09-18T09:00:00Z",
  "tenant_id": "ten_01M11HEQG00000000000000000",
  "region": "eu-west",
  "data": {
    "authority_id": "aut_01M11HEQG00000000000000000",
    "verification_id": "ver_01M11HEQG00000000000000000",
    "state": "active",
    "authority": {
      "id": "aut_01M11HEQG00000000000000000",
      "type": "processing_authority",
      "verification_id": "ver_01M11HEQG00000000000000000",
      "state": "restricted"
    }
  }
}
