{
  "id": "evt_01M11HEQG00000000000000000",
  "type": "check.started",
  "schema_version": "1.0",
  "created_at": "2026-09-18T09:00:00Z",
  "tenant_id": "ten_01M11HEQG00000000000000000",
  "region": "eu-west",
  "data": {
    "verification_id": "ver_01M11HEQG00000000000000000",
    "check_id": "chk_01M11HEQG00000000000000000",
    "version": 1,
    "evidence_type": "idenqa.evidence.selfie",
    "artefact": "selfie",
    "check": {
      "id": "chk_01M11HEQG00000000000000000",
      "type": "verification.check",
      "verification_id": "ver_01M11HEQG00000000000000000",
      "state": "queued",
      "version": 1
    }
  }
}
