{
  "id": "evt_01M11HEQG00000000000000000",
  "type": "appeal.updated",
  "schema_version": "1.0",
  "created_at": "2026-09-18T09:00:00Z",
  "tenant_id": "ten_01M11HEQG00000000000000000",
  "region": "eu-west",
  "data": {
    "appeal_id": "apl_01M11HEQG00000000000000000",
    "case_id": "rvc_01M11HEQG00000000000000000",
    "state": "active",
    "outcome": "verified",
    "appeal": {
      "id": "apl_01M11HEQG00000000000000000",
      "type": "appeal",
      "case_id": "rvc_01M11HEQG00000000000000000",
      "state": "resolved",
      "outcome": "overturned"
    }
  }
}
