{
  "id": "evt_01M11HEQG00000000000000000",
  "type": "verification.completed",
  "schema_version": "1.0",
  "created_at": "2026-09-18T09:00:00Z",
  "tenant_id": "ten_01M11HEQG00000000000000000",
  "region": "eu-west",
  "data": {
    "verification_id": "ver_01M11HEQG00000000000000000",
    "subject_id": "sub_01M11HEQG00000000000000000",
    "decision_id": "dec_01M11HEQG00000000000000000",
    "outcome": "verified",
    "decided_at": "2026-09-18T09:00:00Z",
    "verification": {
      "id": "ver_01M11HEQG00000000000000000",
      "type": "verification.session",
      "status": "completed",
      "outcome": "verified",
      "created_at": "2026-09-18T08:00:00Z",
      "completed_at": "2026-09-18T09:00:00Z",
      "decision_id": "dec_01M11HEQG00000000000000000",
      "decision_outcome": "verified",
      "checks": [
        {
          "id": "chk_01M11HEQG00000000000000000",
          "state": "completed",
          "outcome": "passed"
        }
      ]
    }
  }
}
