{
  "id": "evt_01M11HEQG00000000000000000",
  "type": "evidence.deleted",
  "schema_version": "1.0",
  "created_at": "2026-09-18T09:00:00Z",
  "tenant_id": "ten_01M11HEQG00000000000000000",
  "region": "eu-west",
  "data": {
    "evidence_id": "evd_01M11HEQG00000000000000000",
    "verification_id": "ver_01M11HEQG00000000000000000",
    "reason_code": "policy.verified",
    "evidence": {
      "id": "evd_01M11HEQG00000000000000000",
      "type": "evidence",
      "verification_id": "ver_01M11HEQG00000000000000000",
      "state": "deleted"
    }
  }
}
